{
  "name": "pr-review-canvas",
  "displayName": "PR Review Canvas",
  "version": "0.1.0",
  "description": "Render PR diffs as review canvases grouped by importance.",
  "author": {
    "name": "Cursor",
    "email": "plugins@cursor.com"
  },
  "homepage": "https://github.com/cursor/plugins/tree/main/pr-review-canvas",
  "repository": "https://github.com/cursor/plugins",
  "license": "MIT",
  "logo": "assets/avatar.png",
  "keywords": [
    "cursor-plugin",
    "canvas",
    "pr-review",
    "code-review",
    "diff",
    "pull-request"
  ],
  "category": "developer-tools",
  "tags": [
    "canvas",
    "code-review",
    "pull-request",
    "workflow"
  ],
  "skills": "./skills/"
}
