{
  "name": "profound",
  "displayName": "Profound",
  "version": "1.0.0",
  "minClientVersions": {
    "cursor": "3.13.0"
  },
  "description": "Track AI visibility, sentiment, and citations.",
  "author": {
    "name": "Cursor",
    "email": "plugins@cursor.com"
  },
  "homepage": "https://docs.tryprofound.com/mcp/overview",
  "repository": "https://github.com/cursor/plugins",
  "license": "MIT",
  "logo": "assets/logo.png",
  "keywords": [
    "profound",
    "mcp",
    "aeo",
    "visibility",
    "citations",
    "sentiment",
    "agents",
    "analytics"
  ],
  "category": "integrations",
  "tags": [
    "profound",
    "mcp",
    "analytics",
    "aeo"
  ],
  "mcpServers": "./mcp.json"
}
