{
  "name": "google-drive",
  "displayName": "Google Drive",
  "version": "1.0.1",
  "minClientVersions": {
    "cursor": "3.13.0"
  },
  "description": "Search, read, create, and share files.",
  "author": {
    "name": "Cursor",
    "email": "plugins@cursor.com"
  },
  "homepage": "https://github.com/cursor/plugins/tree/main/third_party/google-drive",
  "repository": "https://github.com/cursor/plugins",
  "license": "MIT",
  "logo": "assets/logo.svg",
  "keywords": [
    "google-drive",
    "drive",
    "google",
    "mcp",
    "files",
    "workspace"
  ],
  "category": "productivity",
  "tags": [
    "drive",
    "files",
    "mcp",
    "google-workspace"
  ],
  "mcpServers": "./mcp.json",
  "skills": "./skills/"
}
