{
  "name": "quickbooks",
  "displayName": "QuickBooks",
  "version": "1.0.0",
  "minClientVersions": {
    "cursor": "3.13.0"
  },
  "description": "Read and write customers, invoices, bills, payments, and reports.",
  "author": {
    "name": "Cursor",
    "email": "plugins@cursor.com"
  },
  "homepage": "https://github.com/intuit/quickbooks-online-mcp-server",
  "repository": "https://github.com/cursor/plugins",
  "license": "MIT",
  "logo": "assets/logo.svg",
  "keywords": [
    "quickbooks",
    "intuit",
    "accounting",
    "invoices",
    "bookkeeping",
    "finance",
    "mcp"
  ],
  "category": "integrations",
  "tags": [
    "quickbooks",
    "accounting",
    "mcp",
    "finance"
  ],
  "variables": {
    "type": "object",
    "properties": {
      "QUICKBOOKS_CLIENT_ID": {
        "type": "string",
        "title": "QuickBooks client ID",
        "description": "Client ID from your app's Keys & Credentials page at developer.intuit.com. Use the Development keys for sandbox and the Production keys for a live company."
      },
      "QUICKBOOKS_CLIENT_SECRET": {
        "type": "string",
        "title": "QuickBooks client secret",
        "description": "Client secret from the same Keys & Credentials page as the client ID."
      },
      "QUICKBOOKS_REFRESH_TOKEN": {
        "type": "string",
        "title": "QuickBooks refresh token",
        "description": "OAuth 2.0 refresh token for the company to connect. For sandbox, generate one in the Intuit OAuth 2.0 Playground; for production, complete the one-time OAuth handshake described in the plugin README. The server rotates and persists it after first use."
      },
      "QUICKBOOKS_REALM_ID": {
        "type": "string",
        "title": "QuickBooks company (realm) ID",
        "description": "Realm ID of the QuickBooks Online company the refresh token was issued for. Shown alongside the token in the OAuth 2.0 Playground and in the OAuth callback."
      },
      "QUICKBOOKS_ENVIRONMENT": {
        "type": "string",
        "title": "QuickBooks environment",
        "description": "Which Intuit environment the credentials belong to. Use sandbox for a developer sandbox company and production for a live company.",
        "enum": [
          "sandbox",
          "production"
        ],
        "default": "sandbox"
      }
    },
    "required": [
      "QUICKBOOKS_CLIENT_ID",
      "QUICKBOOKS_CLIENT_SECRET",
      "QUICKBOOKS_REFRESH_TOKEN",
      "QUICKBOOKS_REALM_ID",
      "QUICKBOOKS_ENVIRONMENT"
    ]
  },
  "mcpServers": "./mcp.json"
}
