{
  "name": "amplemarket",
  "displayName": "Amplemarket",
  "version": "1.0.0",
  "minClientVersions": {
    "cursor": "3.13.0"
  },
  "description": "Search people and companies, enrich leads, run sequences.",
  "author": {
    "name": "Cursor",
    "email": "plugins@cursor.com"
  },
  "homepage": "https://knowledge.amplemarket.com/articles/8022685319-connecting-to-the-amplemarket-mcp-server",
  "repository": "https://github.com/cursor/plugins",
  "license": "MIT",
  "logo": "assets/logo.png",
  "keywords": [
    "amplemarket",
    "sales",
    "prospecting",
    "enrichment",
    "sequences",
    "leads",
    "mcp"
  ],
  "category": "integrations",
  "tags": [
    "amplemarket",
    "sales",
    "mcp",
    "prospecting"
  ],
  "mcpServers": "./mcp.json"
}
