{
  "name": "navan",
  "displayName": "Navan",
  "version": "1.0.0",
  "minClientVersions": {
    "cursor": "3.13.0"
  },
  "description": "Query expenses, travel bookings, policies, and cards.",
  "author": {
    "name": "Cursor",
    "email": "plugins@cursor.com"
  },
  "homepage": "https://developer.navan.com/mcp/",
  "repository": "https://github.com/cursor/plugins",
  "license": "MIT",
  "logo": "assets/logo.png",
  "keywords": [
    "navan",
    "mcp",
    "travel",
    "expenses",
    "spend",
    "corporate-cards",
    "bookings"
  ],
  "category": "integrations",
  "tags": [
    "navan",
    "travel",
    "expenses",
    "mcp"
  ],
  "mcpServers": "./mcp.json"
}
