{
  "name": "marqeta",
  "displayName": "Marqeta",
  "version": "1.0.0",
  "description": "Look up cardholders, cards, card products, transactions, disputes, and spend controls.",
  "author": {
    "name": "Marqeta"
  },
  "homepage": "https://www.marqeta.com/",
  "repository": "https://github.com/marqeta/marqeta-mcp",
  "license": "MIT",
  "logo": "assets/logo.png",
  "keywords": [
    "marqeta",
    "card issuing",
    "payments",
    "cards",
    "transactions",
    "disputes",
    "velocity controls",
    "mcp"
  ],
  "category": "integrations",
  "tags": [
    "marqeta",
    "fintech",
    "payments",
    "mcp"
  ],
  "mcpServers": "./mcp.json"
}
