{
  "name": "corply",
  "displayName": "Corply",
  "version": "1.0.0",
  "description": "Form and run Delaware C-corps: cap tables, founder stock, SAFEs, board consents, and filings.",
  "author": {
    "name": "Corply",
    "email": "vijay@0lumens.com"
  },
  "homepage": "https://corply.dev",
  "repository": "https://github.com/cursor/plugins",
  "license": "MIT",
  "logo": "assets/logo.png",
  "keywords": [
    "corply",
    "incorporation",
    "delaware",
    "c-corp",
    "cap table",
    "equity",
    "safe",
    "governance",
    "compliance",
    "mcp"
  ],
  "category": "integrations",
  "tags": [
    "corply",
    "legal",
    "startups",
    "mcp"
  ],
  "mcpServers": "./mcp.json"
}
