{
  "name": "greenhouse",
  "displayName": "Greenhouse",
  "version": "1.0.0",
  "minClientVersions": {
    "cursor": "3.13.0"
  },
  "description": "Search candidates, jobs, and applications, and review scorecards in Greenhouse Recruiting.",
  "author": {
    "name": "Cursor",
    "email": "plugins@cursor.com"
  },
  "homepage": "https://support.greenhouse.io/hc/en-us/articles/52090956642075-Greenhouse-MCP",
  "repository": "https://github.com/cursor/plugins",
  "license": "MIT",
  "logo": "assets/logo.png",
  "keywords": [
    "greenhouse",
    "ats",
    "recruiting",
    "hiring",
    "candidates",
    "interviews",
    "mcp"
  ],
  "category": "integrations",
  "tags": [
    "greenhouse",
    "recruiting",
    "ats",
    "mcp"
  ],
  "mcpServers": "./mcp.json"
}
