{
  "name": "cursor-team-kit",
  "version": "1.2.0",
  "description": "Internal engineering team workflows for CI, code review, shipping, control-cli, control-ui, verify-this, test reliability, code cleanup, and work summaries. Designed to work without requiring third-party service integrations.",
  "author": {
    "name": "Cursor",
    "email": "plugins@cursor.com"
  },
  "skills": "./skills/"
}
