{
  "name": "orchestrate",
  "version": "1.1.0",
  "description": "Fan a large task out across parallel cloud agents via the Cursor SDK: planners publish tasks, workers hand off back up, and a script reconciles the tree from disk and git.",
  "author": {
    "name": "Cursor",
    "email": "plugins@cursor.com"
  },
  "skills": "./skills/"
}
