{
  "name": "ahrefs",
  "displayName": "Ahrefs",
  "version": "1.0.0",
  "minClientVersions": {
    "cursor": "3.13.0"
  },
  "description": "Research keywords, backlinks, rankings, and site health.",
  "author": {
    "name": "Cursor",
    "email": "plugins@cursor.com"
  },
  "homepage": "https://ahrefs.com/mcp",
  "repository": "https://github.com/cursor/plugins",
  "license": "MIT",
  "logo": "assets/logo.png",
  "keywords": [
    "ahrefs",
    "seo",
    "backlinks",
    "keywords",
    "rank-tracking",
    "site-audit",
    "mcp"
  ],
  "category": "integrations",
  "tags": [
    "ahrefs",
    "seo",
    "mcp",
    "backlinks"
  ],
  "mcpServers": "./mcp.json"
}
